{
  "schema_version": "mulgae-provider-review-output.v2",
  "summary": "One high-severity coordinator issue was identified with a current-target location claim that Mulgae must verify.",
  "completeness": "complete",
  "limitations": [],
  "findings": [
    {
      "severity": "high",
      "title": "Fallback is triggered after a valid negative review",
      "description": "The coordinator appears to treat a valid finding-bearing result as an execution failure, which discards a sound review and reports the role as failed. Mulgae must verify the current target excerpt before accepting the finding.",
      "evidence": [
        {
          "current": {
            "source_identity_sha256": "sha256:cccccccccccccccccccccccccccccccccccccccccccccccccccccccccccccccc",
            "path": "internal/app/coordinator.go",
            "line_start": 120,
            "line_end": 128,
            "side": "head",
            "quote": "if result.RequestChanges {\n    queueFallback(task)\n}",
            "verification": "claimed"
          }
        }
      ],
      "recommendation": "Fail a role only for typed provider availability, execution, or invalid-output failures. Preserve valid negative reviews as successful role results.",
      "confidence": "high"
    }
  ]
}
